{
  "schema_version": 2,
  "_note": "REQ-R7 计分权重外置。维度权重/assumption_confidence 由本文件声明，不再硬编码于 core/lineage.py/prioritize_clues。间类权重从 jians.json 读取（不重复声明）。装载期校验：各 dimension weight 之和必须为 1.0；assumption_confidence 必须有 _default。红线：计分不得反向影响交叉等级——等级只由独立源数决定。 P1-3：data_strength.curve=log（linear 为旧口径），normalize 表示饱和行数；计分口径版本 score_source=scoring.json@v3。",
  "dimensions": [
    {
      "name": "confidence",
      "weight": 0.4,
      "source": "assumption_confidence"
    },
    {
      "name": "jian_coverage",
      "weight": 0.35,
      "source": "jian_weight_sum",
      "normalize": 5.0
    },
    {
      "name": "data_strength",
      "weight": 0.25,
      "source": "source_rows_count",
      "normalize": 50.0,
      "cap": 1.0,
      "curve": "log",
      "note": "对数饱和：log1p(行数)/log1p(normalize)，normalize=50 行饱和；避免 0 行线索压过多行线索"
    }
  ],
  "assumption_confidence": {
    "H1": 0.9,
    "H4": 0.7,
    "_default": 0.7
  }
}
